{
  "schema-version": "2.2.0",
  "data": [
    {
      "name": "in_7",
      "source": "csv:in_7.csv",
      "structure": "in_7_str"
    },
    {
      "name": "in_6",
      "source": "csv:in_6.csv",
      "structure": "in_6_str"
    },
    {
      "name": "ex_3",
      "structure": "gr_2_str",
      "source": "csv:ex_3.csv"
    }
  ],
  "structures": [
    {
      "name": "gr_2_str",
      "components": [
        {
          "name": "id_1",
          "role": "Identifier"
        },
        {
          "name": "id_3",
          "role": "Identifier"
        },
        {
          "name": "id_4",
          "role": "Identifier"
        },
        {
          "name": "gr",
          "role": "Measure"
        },
        {
          "name": "id_2",
          "role": "Identifier"
        },
        {
          "name": "num_1",
          "role": "Measure"
        }
      ]
    },
    {
      "name": "in_7_str",
      "components": [
        {
          "name": "id_1",
          "role": "Identifier"
        },
        {
          "name": "id_3",
          "role": "Identifier"
        },
        {
          "name": "id_4",
          "role": "Identifier"
        },
        {
          "name": "id_2",
          "role": "Identifier"
        },
        {
          "name": "num_1",
          "role": "Measure"
        }
      ]
    },
    {
      "name": "in_6_str",
      "components": [
        {
          "name": "id_1",
          "role": "Identifier"
        },
        {
          "name": "id_3",
          "role": "Identifier"
        },
        {
          "name": "id_4",
          "role": "Identifier"
        },
        {
          "name": "id_2",
          "role": "Identifier"
        },
        {
          "name": "num_1",
          "role": "Measure"
        }
      ]
    }
  ],
  "variables": [
    {
      "name": "id_2",
      "domain": "string"
    },
    {
      "name": "gr",
      "domain": "boolean"
    },
    {
      "name": "id_3",
      "domain": "string"
    },
    {
      "name": "id_4",
      "domain": "string"
    },
    {
      "name": "id_1",
      "domain": "number"
    },
    {
      "name": "bool_var",
      "domain": "boolean"
    },
    {
      "name": "num_1",
      "domain": "number"
    }
  ]
}
