{
  "schema-version": "2.2.0",
  "data": [
    {
      "name": "in_3",
      "source": "csv:in_3.csv",
      "structure": "in_3_str"
    },
    {
      "name": "ex_2",
      "structure": "ex_2_str",
      "source": "csv:ex_2.csv"
    }
  ],
  "structures": [
    {
      "name": "ex_2_str",
      "components": [
        {
          "name": "id_2",
          "role": "Identifier"
        },
        {
          "name": "id_4",
          "role": "Identifier"
        },
        {
          "name": "me_1",
          "role": "Measure"
        },
        {
          "name": "id_3",
          "role": "Identifier"
        },
        {
          "name": "id_1",
          "role": "Identifier"
        },
        {
          "name": "andt",
          "role": "Measure"
        },
        {
          "name": "andf",
          "role": "Measure"
        }
      ]
    },
    {
      "name": "in_3_str",
      "components": [
        {
          "name": "id_2",
          "role": "Identifier"
        },
        {
          "name": "id_4",
          "role": "Identifier"
        },
        {
          "name": "me_1",
          "role": "Measure"
        },
        {
          "name": "id_3",
          "role": "Identifier"
        },
        {
          "name": "id_1",
          "role": "Identifier"
        }
      ]
    }
  ],
  "variables": [
    {
      "name": "id_1",
      "domain": "string"
    },
    {
      "name": "andt",
      "domain": "boolean"
    },
    {
      "name": "res2",
      "domain": "boolean"
    },
    {
      "name": "id_3",
      "domain": "string"
    },
    {
      "name": "andf",
      "domain": "boolean"
    },
    {
      "name": "me_1",
      "domain": "boolean"
    },
    {
      "name": "id_2",
      "domain": "number"
    },
    {
      "name": "id_4",
      "domain": "number"
    },
    {
      "name": "res1",
      "domain": "boolean"
    }
  ]
}
