{
  "schema-version": "2.2.0",
  "data": [
    {
      "name": "in_2",
      "source": "csv:in_2.csv",
      "structure": "in_2_str"
    },
    {
      "name": "ex_2",
      "structure": "ex_2_str",
      "source": "csv:ex_2.csv"
    }
  ],
  "structures": [
    {
      "name": "ex_2_str",
      "components": [
        {
          "name": "me_sum",
          "role": "Measure"
        },
        {
          "name": "exr_suffix",
          "role": "Measure"
        },
        {
          "name": "time_format",
          "role": "Attribute"
        },
        {
          "name": "freq",
          "role": "Measure"
        },
        {
          "name": "id_1",
          "role": "Identifier"
        },
        {
          "name": "id",
          "role": "Attribute"
        },
        {
          "name": "title",
          "role": "Attribute"
        },
        {
          "name": "unit_mult",
          "role": "Attribute"
        },
        {
          "name": "year",
          "role": "Identifier"
        },
        {
          "name": "unit",
          "role": "Attribute"
        },
        {
          "name": "currency",
          "role": "Measure"
        },
        {
          "name": "currency_denom",
          "role": "Measure"
        },
        {
          "name": "me_2",
          "role": "Measure"
        },
        {
          "name": "source_agency",
          "role": "Attribute"
        },
        {
          "name": "me_1",
          "role": "Measure"
        },
        {
          "name": "exr_type",
          "role": "Measure"
        },
        {
          "name": "decimals",
          "role": "Attribute"
        },
        {
          "name": "collection",
          "role": "Attribute"
        },
        {
          "name": "obs_status",
          "role": "Attribute"
        }
      ]
    },
    {
      "name": "in_2_str",
      "components": [
        {
          "name": "exr_suffix",
          "role": "Measure"
        },
        {
          "name": "time_format",
          "role": "Attribute"
        },
        {
          "name": "freq",
          "role": "Measure"
        },
        {
          "name": "id_1",
          "role": "Identifier"
        },
        {
          "name": "id",
          "role": "Attribute"
        },
        {
          "name": "title",
          "role": "Attribute"
        },
        {
          "name": "unit_mult",
          "role": "Attribute"
        },
        {
          "name": "year",
          "role": "Identifier"
        },
        {
          "name": "unit",
          "role": "Attribute"
        },
        {
          "name": "currency",
          "role": "Measure"
        },
        {
          "name": "currency_denom",
          "role": "Measure"
        },
        {
          "name": "me_2",
          "role": "Measure"
        },
        {
          "name": "source_agency",
          "role": "Attribute"
        },
        {
          "name": "me_1",
          "role": "Measure"
        },
        {
          "name": "exr_type",
          "role": "Measure"
        },
        {
          "name": "decimals",
          "role": "Attribute"
        },
        {
          "name": "collection",
          "role": "Attribute"
        },
        {
          "name": "obs_status",
          "role": "Attribute"
        }
      ]
    }
  ],
  "variables": [
    {
      "name": "unit",
      "domain": "string"
    },
    {
      "name": "decimals",
      "domain": "string"
    },
    {
      "name": "currency_denom",
      "domain": "string"
    },
    {
      "name": "source_agency",
      "domain": "string"
    },
    {
      "name": "exr_suffix",
      "domain": "string"
    },
    {
      "name": "collection",
      "domain": "string"
    },
    {
      "name": "title",
      "domain": "string"
    },
    {
      "name": "freq",
      "domain": "string"
    },
    {
      "name": "id_1",
      "domain": "string"
    },
    {
      "name": "id",
      "domain": "string"
    },
    {
      "name": "exr_type",
      "domain": "string"
    },
    {
      "name": "time_format",
      "domain": "string"
    },
    {
      "name": "obs_status",
      "domain": "string"
    },
    {
      "name": "year",
      "domain": "integer"
    },
    {
      "name": "unit_mult",
      "domain": "string"
    },
    {
      "name": "currency",
      "domain": "string"
    },
    {
      "name": "me_2",
      "domain": "integer"
    },
    {
      "name": "me_sum",
      "domain": "number"
    },
    {
      "name": "me_1",
      "domain": "number"
    }
  ]
}
