{
  "schema-version": "2.2.0",
  "data": [
    {
      "name": "ds_1",
      "structure": "DS_1",
      "source": "csv:ds_1.csv"
    },
    {
      "name": "ds_2",
      "structure": "DS_2",
      "source": "csv:ds_2.csv"
    },
    {
      "name": "ex_5",
      "structure": "DS_r",
      "source": "csv:ex_5.csv"
    }
  ],
  "structures": [
    {
      "name": "DS_1",
      "components": [
        {
          "name": "Id_1",
          "role": "Identifier"
        },
        {
          "name": "Id_2",
          "role": "Identifier"
        },
        {
          "name": "Me_1",
          "role": "Measure"
        },
        {
          "name": "Me_2",
          "role": "Measure"
        }
      ]
    },
    {
      "name": "DS_2",
      "components": [
        {
          "name": "Id_1",
          "role": "Identifier"
        },
        {
          "name": "Id_2",
          "role": "Identifier"
        },
        {
          "name": "Me_1A",
          "role": "Measure"
        },
        {
          "name": "Me_2",
          "role": "Measure"
        }
      ]
    },
    {
      "name": "DS_r",
      "components": [
        {
          "name": "Id_1",
          "role": "Identifier"
        },
        {
          "name": "Id_2",
          "role": "Identifier"
        },
        {
          "name": "Me_1",
          "role": "Measure"
        },
        {
          "name": "Me_1A",
          "role": "Measure"
        },
        {
          "name": "Me_2",
          "role": "Measure"
        },
        {
          "name": "Me_4",
          "role": "Measure"
        }
      ]
    }
  ],
  "variables": [
    {
      "name": "Id_1",
      "domain": "integer"
    },
    {
      "name": "Id_2",
      "domain": "string"
    },
    {
      "name": "Me_1",
      "domain": "string"
    },
    {
      "name": "Me_1A",
      "domain": "string"
    },
    {
      "name": "Me_2",
      "domain": "string"
    },
    {
      "name": "Me_4",
      "domain": "string"
    }
  ]
}
