{
  "schema-version": "2.2.0",
  "data": [
    {
      "name": "in_4",
      "source": "csv:in_4.csv",
      "structure": "in_4_str"
    },
    {
      "name": "ex_4",
      "structure": "ex_4_str",
      "source": "csv:ex_4.csv"
    }
  ],
  "structures": [
    {
      "name": "in_4_str",
      "components": [
        {
          "name": "id_1",
          "role": "Identifier"
        },
        {
          "name": "text_2",
          "role": "Measure"
        },
        {
          "name": "text_1",
          "role": "Measure"
        },
        {
          "name": "id_3",
          "role": "Identifier"
        },
        {
          "name": "id_2",
          "role": "Identifier"
        }
      ]
    },
    {
      "name": "ex_4_str",
      "components": [
        {
          "name": "id_1",
          "role": "Identifier"
        },
        {
          "name": "text_3",
          "role": "Measure"
        },
        {
          "name": "text_2",
          "role": "Measure"
        },
        {
          "name": "text_1",
          "role": "Measure"
        },
        {
          "name": "id_3",
          "role": "Identifier"
        },
        {
          "name": "id_2",
          "role": "Identifier"
        },
        {
          "name": "text_4",
          "role": "Measure"
        }
      ]
    }
  ],
  "variables": [
    {
      "name": "id_2",
      "domain": "string"
    },
    {
      "name": "id_3",
      "domain": "string"
    },
    {
      "name": "id_1",
      "domain": "integer"
    },
    {
      "name": "text_3",
      "domain": "string"
    },
    {
      "name": "text_4",
      "domain": "string"
    },
    {
      "name": "text_1",
      "domain": "string"
    },
    {
      "name": "text_2",
      "domain": "string"
    }
  ]
}
