{
  "schema-version": "2.2.0",
  "data": [
    {
      "name": "in_2",
      "source": "csv:in_2.csv",
      "structure": "in_2_str"
    },
    {
      "name": "comparison_eq_1",
      "source": "csv:comparison_eq_1.csv",
      "structure": "comparison_eq_1_str"
    },
    {
      "name": "in_1",
      "source": "csv:in_1.csv",
      "structure": "in_1_str"
    },
    {
      "name": "ex_1",
      "structure": "ex_1_str",
      "source": "csv:ex_1.csv"
    }
  ],
  "structures": [
    {
      "name": "ex_1_str",
      "components": [
        {
          "name": "id1",
          "role": "Identifier"
        },
        {
          "name": "bool_var",
          "role": "Measure"
        }
      ]
    },
    {
      "name": "in_2_str",
      "components": [
        {
          "name": "id1",
          "role": "Identifier"
        },
        {
          "name": "m1",
          "role": "Measure"
        }
      ]
    },
    {
      "name": "comparison_eq_1_str",
      "components": [
        {
          "name": "id1",
          "role": "Identifier"
        },
        {
          "name": "m1",
          "role": "Measure"
        }
      ]
    },
    {
      "name": "in_1_str",
      "components": [
        {
          "name": "id1",
          "role": "Identifier"
        },
        {
          "name": "m1",
          "role": "Measure"
        },
        {
          "name": "att1",
          "role": "Attribute"
        }
      ]
    }
  ],
  "variables": [
    {
      "name": "m1",
      "domain": "number"
    },
    {
      "name": "id1",
      "domain": "string"
    },
    {
      "name": "att1",
      "domain": "string"
    },
    {
      "name": "bool_var",
      "domain": "boolean"
    }
  ]
}
