{
  "schema-version": "2.2.0",
  "data": [
    {
      "name": "in_1",
      "source": "csv:in_1.csv",
      "structure": "in_1_str"
    },
    {
      "name": "ex_1",
      "structure": "ex_1_str",
      "source": "csv:ex_1.csv"
    }
  ],
  "structures": [
    {
      "name": "in_1_str",
      "components": [
        {
          "name": "id_3",
          "role": "Identifier"
        },
        {
          "name": "id_1",
          "role": "Identifier"
        },
        {
          "name": "me_1",
          "role": "Measure"
        },
        {
          "name": "id_daily",
          "role": "Identifier"
        }
      ]
    },
    {
      "name": "ex_1_str",
      "components": [
        {
          "name": "id_3",
          "role": "Identifier"
        },
        {
          "name": "id_1",
          "role": "Identifier"
        },
        {
          "name": "me_1",
          "role": "Measure"
        },
        {
          "name": "id_daily",
          "role": "Identifier"
        }
      ]
    }
  ],
  "variables": [
    {
      "name": "id_1",
      "domain": "string"
    },
    {
      "name": "res4",
      "domain": "boolean"
    },
    {
      "name": "res3",
      "domain": "boolean"
    },
    {
      "name": "res2",
      "domain": "boolean"
    },
    {
      "name": "id_3",
      "domain": "string"
    },
    {
      "name": "id_daily",
      "domain": "date"
    },
    {
      "name": "res1",
      "domain": "boolean"
    },
    {
      "name": "me_1",
      "domain": "number"
    }
  ]
}
