{
  "schema-version": "2.2.0",
  "data": [
    {
      "name": "ds_2",
      "structure": "DS_1",
      "source": "spark:csv:ds_2.csv"
    },
    {
      "name": "ex_6",
      "structure": "DS_r",
      "source": "spark:csv:ex_6.csv"
    }
  ],
  "structures": [
    {
      "name": "DS_1",
      "components": [
        {
          "name": "Id_1",
          "role": "Identifier"
        },
        {
          "name": "Id_2",
          "role": "Identifier"
        },
        {
          "name": "Me_1",
          "role": "Measure"
        },
        {
          "name": "Me_2",
          "role": "Measure"
        },
        {
          "name": "At_1",
          "role": "Viral Attribute"
        }
      ]
    },
    {
      "name": "DS_r",
      "components": [
        {
          "name": "Id_1",
          "role": "Identifier"
        },
        {
          "name": "Id_2",
          "role": "Identifier"
        },
        {
          "name": "string_var",
          "role": "Measure"
        },
        {
          "name": "At_1",
          "role": "Viral Attribute"
        }
      ]
    }
  ],
  "variables": [
    {
      "name": "At_1",
      "domain": "string"
    },
    {
      "name": "Id_1",
      "domain": "integer"
    },
    {
      "name": "Id_2",
      "domain": "string"
    },
    {
      "name": "Me_1",
      "domain": "integer"
    },
    {
      "name": "Me_2",
      "domain": "integer"
    },
    {
      "name": "string_var",
      "domain": "string"
    }
  ]
}
