{
  "schema-version": "2.2.0",
  "data": [
    {
      "name": "ds_1",
      "structure": "DS_1",
      "source": "spark:csv:ds_1.csv"
    },
    {
      "name": "ds_3",
      "structure": "DS_3",
      "source": "spark:csv:ds_3.csv"
    },
    {
      "name": "ex_7",
      "structure": "DS_r",
      "source": "spark:csv:ex_7.csv"
    }
  ],
  "structures": [
    {
      "name": "DS_1",
      "components": [
        {
          "name": "Id_1",
          "role": "Identifier"
        },
        {
          "name": "Id_2",
          "role": "Identifier"
        },
        {
          "name": "Me_1",
          "role": "Measure"
        },
        {
          "name": "Me_2",
          "role": "Measure"
        }
      ]
    },
    {
      "name": "DS_3",
      "components": [
        {
          "name": "Id_1",
          "role": "Identifier"
        },
        {
          "name": "Id_2",
          "role": "Identifier"
        },
        {
          "name": "Me_1",
          "role": "Measure"
        },
        {
          "name": "Me_2",
          "role": "Measure"
        }
      ]
    },
    {
      "name": "DS_r",
      "components": [
        {
          "name": "Id_1",
          "role": "Identifier"
        },
        {
          "name": "Id_2",
          "role": "Identifier"
        },
        {
          "name": "Me_1",
          "role": "Measure"
        },
        {
          "name": "Me_2",
          "role": "Measure"
        }
      ]
    }
  ],
  "variables": [
    {
      "name": "Id_1",
      "domain": "integer"
    },
    {
      "name": "Id_2",
      "domain": "string"
    },
    {
      "name": "Me_1",
      "domain": "string"
    },
    {
      "name": "Me_2",
      "domain": "string"
    }
  ]
}
